{
  "schemaVersion": 2,
  "id": "forbidden-city",
  "name": "故宫",
  "frame": {
    "origin": [
      116.3972,
      39.918
    ],
    "unitMeters": 20,
    "bounds": {
      "minX": -22,
      "maxX": 22,
      "minZ": -29,
      "maxZ": 29
    },
    "source": "故宫博物院建筑布局 · 人工示意配准",
    "axes": {
      "x": "east",
      "z": "south"
    },
    "projection": {
      "lonUnits": 4270,
      "latUnits": 5550
    }
  },
  "provenance": {
    "attribution": "建筑与布局参考：故宫博物院",
    "url": "https://www.dpm.org.cn/",
    "fetched": "2026-10-14",
    "notes": [
      "据故宫博物院建筑布局与全景资料人工整理的游览示意；占地、尺度与路线经过展示性简化，非测绘或实时现场导航。太和门主通道关闭，侧通道为展示绕行。",
      "坐标原点近似，建筑位置与体量用于预览；未进行测绘配准。",
      "外朝、内廷、东西宫区、御花园的相对位置据官方资料核对。",
      "配院、花木与石景为依整体分区整理的展示性布景，不对应每一株古树或院落开放边界。"
    ]
  },
  "water": [
    [
      [
        -19.75,
        -27
      ],
      [
        19.75,
        -27
      ],
      [
        19.75,
        27
      ],
      [
        -19.75,
        27
      ]
    ],
    [
      [
        -18.35,
        -25.35
      ],
      [
        18.35,
        -25.35
      ],
      [
        18.35,
        25.35
      ],
      [
        6,
        25.35
      ],
      [
        6,
        26.8
      ],
      [
        -6,
        26.8
      ],
      [
        -6,
        25.35
      ],
      [
        -18.35,
        25.35
      ]
    ],
    [
      [
        -16.8,
        18.6
      ],
      [
        -10,
        18.6
      ],
      [
        -6,
        18.1
      ],
      [
        0,
        17.6
      ],
      [
        6,
        18.1
      ],
      [
        10,
        18.6
      ],
      [
        16.8,
        18.6
      ],
      [
        16.8,
        19.2
      ],
      [
        10,
        19.2
      ],
      [
        6,
        18.7
      ],
      [
        0,
        18.2
      ],
      [
        -6,
        18.7
      ],
      [
        -10,
        19.2
      ],
      [
        -16.8,
        19.2
      ]
    ]
  ],
  "places": {
    "wumen": [
      0,
      24.3
    ],
    "taihemen": [
      0,
      14.3
    ],
    "taihedian": [
      0,
      7.4
    ],
    "zhonghedian": [
      0,
      2.5
    ],
    "baohedian": [
      0,
      -1.7
    ],
    "qianqinggong": [
      0,
      -9.5
    ],
    "jiaotaidian": [
      0,
      -13.1
    ],
    "kunninggong": [
      0,
      -16.5
    ],
    "garden": [
      0,
      -21.8
    ],
    "shenwumen": [
      0,
      -24.3
    ],
    "ningshou": [
      10.8,
      -13
    ],
    "cining": [
      -10.8,
      -5.2
    ]
  },
  "causeways": [],
  "bridge": {
    "length": 1.2,
    "height": 0.08,
    "gap": 0.03
  },
  "terrain": {
    "cell": 0.05,
    "hills": [],
    "westRidge": {
      "startX": -100,
      "width": 1,
      "height": 0,
      "noise": 0
    },
    "city": {
      "eastX": 100,
      "eastWidth": 1,
      "northX": 100,
      "northWidth": 1,
      "northZ": -100,
      "northDepth": 1
    }
  },
  "network": {
    "nodes": {
      "wumen-view": [
        0,
        22.5
      ],
      "taihemen-view": [
        0,
        16
      ],
      "taihedian-view": [
        0,
        10.6
      ],
      "zhonghedian-view": [
        0,
        4.4
      ],
      "baohedian-view": [
        0,
        0.5
      ],
      "qianqinggong-view": [
        0,
        -7.6
      ],
      "jiaotaidian-view": [
        0,
        -11.7
      ],
      "kunninggong-view": [
        0,
        -15.1
      ],
      "garden-view": [
        0,
        -19.2
      ],
      "shenwumen-view": [
        0,
        -23.1
      ],
      "ningshou-view": [
        10.8,
        -11.6
      ],
      "cining-view": [
        -10.8,
        -3.8
      ],
      "entry": [
        0,
        27
      ],
      "north-exit": [
        0,
        -26
      ],
      "east-exit": [
        19,
        5.8
      ],
      "n-0-2": [
        -16.5,
        22.5
      ],
      "n-0-3": [
        -16.5,
        20
      ],
      "n-0-5": [
        -16.5,
        17
      ],
      "n-0-6": [
        -16.5,
        16
      ],
      "n-0-8": [
        -16.5,
        12.8
      ],
      "n-0-9": [
        -16.5,
        10.6
      ],
      "n-0-10": [
        -16.5,
        9.6
      ],
      "n-0-11": [
        -16.5,
        7.4
      ],
      "n-0-12": [
        -16.5,
        5.8
      ],
      "n-0-13": [
        -16.5,
        4.4
      ],
      "n-0-14": [
        -16.5,
        2.5
      ],
      "n-0-15": [
        -16.5,
        0.5
      ],
      "n-0-16": [
        -16.5,
        -1.7
      ],
      "n-0-17": [
        -16.5,
        -3.8
      ],
      "n-0-18": [
        -16.5,
        -4.8
      ],
      "n-0-19": [
        -16.5,
        -5.6
      ],
      "n-0-20": [
        -16.5,
        -6.6
      ],
      "n-0-21": [
        -16.5,
        -7.6
      ],
      "n-0-22": [
        -16.5,
        -9.5
      ],
      "n-0-23": [
        -16.5,
        -11.7
      ],
      "n-0-24": [
        -16.5,
        -13.1
      ],
      "n-0-25": [
        -16.5,
        -15.1
      ],
      "n-0-26": [
        -16.5,
        -16.5
      ],
      "n-0-27": [
        -16.5,
        -18.2
      ],
      "n-0-28": [
        -16.5,
        -19.2
      ],
      "n-0-29": [
        -16.5,
        -20.5
      ],
      "n-0-30": [
        -16.5,
        -23.1
      ],
      "n-1-2": [
        -12.8,
        22.5
      ],
      "n-1-3": [
        -12.8,
        20
      ],
      "n-1-5": [
        -12.8,
        17
      ],
      "n-1-6": [
        -12.8,
        16
      ],
      "n-1-8": [
        -12.8,
        12.8
      ],
      "n-1-9": [
        -12.8,
        10.6
      ],
      "n-1-10": [
        -12.8,
        9.6
      ],
      "n-1-11": [
        -12.8,
        7.4
      ],
      "n-1-12": [
        -12.8,
        5.8
      ],
      "n-1-13": [
        -12.8,
        4.4
      ],
      "n-1-14": [
        -12.8,
        2.5
      ],
      "n-1-15": [
        -12.8,
        0.5
      ],
      "n-1-16": [
        -12.8,
        -1.7
      ],
      "n-1-17": [
        -12.8,
        -3.8
      ],
      "n-1-18": [
        -12.8,
        -4.8
      ],
      "n-1-19": [
        -12.8,
        -5.6
      ],
      "n-1-20": [
        -12.8,
        -6.6
      ],
      "n-1-21": [
        -12.8,
        -7.6
      ],
      "n-1-22": [
        -12.8,
        -9.5
      ],
      "n-1-23": [
        -12.8,
        -11.7
      ],
      "n-1-24": [
        -12.8,
        -13.1
      ],
      "n-1-25": [
        -12.8,
        -15.1
      ],
      "n-1-26": [
        -12.8,
        -16.5
      ],
      "n-1-27": [
        -12.8,
        -18.2
      ],
      "n-1-28": [
        -12.8,
        -19.2
      ],
      "n-1-29": [
        -12.8,
        -20.5
      ],
      "n-1-30": [
        -12.8,
        -23.1
      ],
      "n-2-2": [
        -9.5,
        22.5
      ],
      "n-2-3": [
        -9.5,
        20
      ],
      "n-2-5": [
        -9.5,
        17
      ],
      "n-2-6": [
        -9.5,
        16
      ],
      "n-2-7": [
        -9.5,
        14.3
      ],
      "n-2-8": [
        -9.5,
        12.8
      ],
      "n-2-11": [
        -9.5,
        7.4
      ],
      "n-2-12": [
        -9.5,
        5.8
      ],
      "n-2-15": [
        -9.5,
        0.5
      ],
      "n-2-16": [
        -9.5,
        -1.7
      ],
      "n-2-17": [
        -9.5,
        -3.8
      ],
      "n-2-20": [
        -9.5,
        -6.6
      ],
      "n-2-21": [
        -9.5,
        -7.6
      ],
      "n-2-22": [
        -9.5,
        -9.5
      ],
      "n-2-25": [
        -9.5,
        -15.1
      ],
      "n-2-28": [
        -9.5,
        -19.2
      ],
      "n-2-29": [
        -9.5,
        -20.5
      ],
      "n-2-30": [
        -9.5,
        -23.1
      ],
      "n-3-2": [
        -6.5,
        22.5
      ],
      "n-3-3": [
        -6.5,
        20
      ],
      "n-3-5": [
        -6.5,
        17
      ],
      "n-3-6": [
        -6.5,
        16
      ],
      "n-3-8": [
        -6.5,
        12.8
      ],
      "n-3-9": [
        -6.5,
        10.6
      ],
      "n-3-10": [
        -6.5,
        9.6
      ],
      "n-3-11": [
        -6.5,
        7.4
      ],
      "n-3-12": [
        -6.5,
        5.8
      ],
      "n-3-13": [
        -6.5,
        4.4
      ],
      "n-3-14": [
        -6.5,
        2.5
      ],
      "n-3-15": [
        -6.5,
        0.5
      ],
      "n-3-16": [
        -6.5,
        -1.7
      ],
      "n-3-17": [
        -6.5,
        -3.8
      ],
      "n-3-18": [
        -6.5,
        -4.8
      ],
      "n-3-20": [
        -6.5,
        -6.6
      ],
      "n-3-21": [
        -6.5,
        -7.6
      ],
      "n-3-22": [
        -6.5,
        -9.5
      ],
      "n-3-23": [
        -6.5,
        -11.7
      ],
      "n-3-24": [
        -6.5,
        -13.1
      ],
      "n-3-25": [
        -6.5,
        -15.1
      ],
      "n-3-26": [
        -6.5,
        -16.5
      ],
      "n-3-27": [
        -6.5,
        -18.2
      ],
      "n-3-28": [
        -6.5,
        -19.2
      ],
      "n-3-29": [
        -6.5,
        -20.5
      ],
      "n-3-30": [
        -6.5,
        -23.1
      ],
      "n-4-2": [
        -4.5,
        22.5
      ],
      "n-4-3": [
        -4.5,
        20
      ],
      "n-4-4": [
        -4.5,
        18.8
      ],
      "n-4-5": [
        -4.5,
        17
      ],
      "n-4-6": [
        -4.5,
        16
      ],
      "n-4-8": [
        -4.5,
        12.8
      ],
      "n-4-9": [
        -4.5,
        10.6
      ],
      "n-4-10": [
        -4.5,
        9.6
      ],
      "n-4-11": [
        -4.5,
        7.4
      ],
      "n-4-12": [
        -4.5,
        5.8
      ],
      "n-4-13": [
        -4.5,
        4.4
      ],
      "n-4-14": [
        -4.5,
        2.5
      ],
      "n-4-15": [
        -4.5,
        0.5
      ],
      "n-4-16": [
        -4.5,
        -1.7
      ],
      "n-4-17": [
        -4.5,
        -3.8
      ],
      "n-4-18": [
        -4.5,
        -4.8
      ],
      "n-4-20": [